<?xml version="1.0" encoding="utf-8" ?>
<checklistSet
  xmlns:xsi="http://www.w3.org/2001/XMLSchema-instance"
  xmlns="http://tempuri.org/Schema.xsd"
  xsi:noNamespaceSchemaLocation="ChecklistSchema.xsd"
  firstChecklistId="batteryOn">
  <meta>
    <label>A320 FBW checklist</label>
    <author>Marek Vajgl</author>
    <description>Simple checklists test for A320 FBW customized</description>
  </meta>
  <checklist id="beforeStart" callSpeech="Before Start-up">
    <item>
      <call type="speech" value="Parking Brake"/>
      <confirmation type="speech" value="Set"/>
    </item>
    <item>
      <call type="speech" value="Seatbelts"/>
      <confirmation type="speech" value="On"/>
    </item>
    <item>
      <call type="speech" value="IRS alging"/>
      <confirmation type="speech" value="Set"/>
    </item>
    <item>
      <call type="speech" value="M C D U departure"/>
      <confirmation type="speech" value="Set"/>
    </item>
    <item>
      <call type="speech" value="Squawk Code"/>
      <confirmation type="speech" value="Set"/>
    </item>
    <item>
      <call type="speech" value="A P U"/>
      <confirmation type="speech" value="Started"/>
    </item>
    <item>
      <call type="speech" value="External Power"/>
      <confirmation type="speech" value="Disconnected"/>
    </item>
    <item>
      <call type="speech" value="Packs"/>
      <confirmation type="speech" value="Off"/>
    </item>
    <item>
      <call type="speech" value="Doors"/>
      <confirmation type="speech" value="Closed"/>
    </item>
    <item>
      <call type="speech" value="Packs"/>
      <confirmation type="speech" value="Off"/>
    </item>
    <item>
      <call type="speech" value="Throttles"/>
      <confirmation type="speech" value="Idle"/>
    </item>
    <item>
      <call type="speech" value="Surfaces"/>
      <confirmation type="speech" value="Checked"/>
    </item>
    <nextChecklistId />
  </checklist>
  <checklist id="inTaxi" callSpeech="In Taxi">
    <item>
      <call type="speech" value="Packs"/>
      <confirmation type="speech" value="On"/>
    </item>
    <item>
      <call type="speech" value="A P U Bleed"/>
      <confirmation type="speech" value="Off"/>
    </item>
    <item>
      <call type="speech" value="Flaps"/>
      <confirmation type="speech" value="Set"/>
    </item>
    <item>
      <call type="speech" value="Autobrake"/>
      <confirmation type="speech" value="Set"/>
    </item>
    <item>
      <call type="speech" value="T O check button"/>
      <confirmation type="speech" value="Green"/>
    </item>
    <item>
      <call type="speech" value="Weather Radar"/>
      <confirmation type="speech" value="On"/>
    </item>
    <nextChecklistId />
  </checklist>
  <checklist id="beforeTakeoff" callSpeech="Before Take Off">
    <item>
      <call type="speech" value="Landing Lights"/>
      <confirmation type="speech" value="On"/>
    </item>
    <item>
      <call type="speech" value="Strobe Light"/>
      <confirmation type="speech" value="On"/>
    </item>
    <item>
      <call type="speech" value="Crew"/>
      <confirmation type="speech" value="Alerted"/>
    </item>
    <item>
      <call type="speech" value="Packs"/>
      <confirmation type="speech" value="Off"/>
    </item>
    <item>
      <call type="speech" value="Squawk Mode"/>
      <confirmation type="speech" value="Charlie"/>
    </item>
    <item>
      <call type="speech" value="Terrain"/>
      <confirmation type="speech" value="As required"/>
    </item>
    <item>
      <call type="speech" value="Clock"/>
      <confirmation type="speech" value="Run"/>
    </item>
    <item>
      <call type="speech" value="Flight Director"/>
      <confirmation type="speech" value="On"/>
    </item>
    <nextChecklistId/>
  </checklist>
  <checklist id="afterTakeoff" callSpeech="After Take Off">
    <item>
      <call type="speech" value="Gear" />
      <confirmation type="speech" value="Up" />
    </item>
    <item>
      <call type="speech" value="Flaps" />
      <confirmation type="speech" value="One" />
    </item>
    <item>
      <call type="speech" value="Autopilot" />
      <confirmation type="speech" value="As required" />
    </item>
    <metaInfo>
      <autostart>
        <property name="height" direction="above" value="400"/>
      </autostart>
    </metaInfo>
    <nextChecklistId/>
  </checklist>
  <checklist id="departure" callSpeech="Departure">
    <item>
      <call type="speech" value="Flaps" />
      <confirmation type="speech" value="Up" />
    </item>
    <item>
      <call type="speech" value="A P U" />
      <confirmation type="speech" value="Off" />
    </item>
    <item>
      <call type="speech" value="Packs" />
      <confirmation type="speech" value="On" />
    </item>
    <nextChecklistId/>
  </checklist>
  <checklist id="descent" callSpeech="Descent">
    <item>
      <call type="speech" value="Pressurezation" />
      <confirmation type="speech" value="Verify" />
    </item>
    <nextChecklistId/>
  </checklist>
  <checklist id="approach" callSpeech="Approach">
    <item>
      <call type="speech" value="Landing Data" />
      <confirmation type="speech" value="Check" />
    </item>
    <nextChecklistId/>
  </checklist>
  <checklist id="beforeLanding" callSpeech="Before Landing">
    <item>
      <call type="speech" value="Landing Gear" />
      <confirmation type="speech" value="Down Three Green" />
    </item>
    <nextChecklistId id="vacated" />
    <checklist id="goAround" callSpeech="Go Around">
      <item>
        <call type="speech" value="Gear"/>
        <confirmation type="speech" value="Up"/>
      </item>
      <item>
        <call type="speech" value="Flaps"/>
        <confirmation type="speech" value="As required"/>
      </item>
      <nextChecklistId id="approach" />
    </checklist>
  </checklist>
  <checklist id="vacated" callSpeech="Vacated">
    <item>
      <call type="speech" value="Speed Brakes" />
      <confirmation type="speech" value="Retracted" />
    </item>
    <nextChecklistId id="beforeStart" />
  </checklist>
</checklistSet>
